{
  "schemaVersion": "guide-views/1.0",
  "recordsVersion": "guide-records/2.0",
  "datasetId": "sha256:13754f97c33a4b87dcb5ab29f7bf9e2b741916732290c6d7c574679a66a80a61",
  "catalogId": "sha256:40d7e6c93955b97961e6d35a4bc643db51d06141c46aa2198d477b84faeee31f",
  "origin": "composed",
  "page": {
    "kind": "answer",
    "record": null
  },
  "layout": "stack",
  "root": [
    "answer",
    "graph"
  ],
  "components": [
    {
      "id": "answer",
      "kind": "section",
      "group": "matches",
      "record": null,
      "sequence": "suggested",
      "disclosure": "open",
      "children": [
        "browser-epic",
        "wall-card"
      ]
    },
    {
      "id": "browser-epic",
      "kind": "epic",
      "record": "jimmie-potts/agent-device-hub#900100",
      "presentation": "full",
      "children": [
        "epic-next"
      ],
      "reasons": [
        {
          "code": "question-match",
          "evidence": [
            {
              "field": "title"
            }
          ]
        }
      ]
    },
    {
      "id": "epic-next",
      "kind": "section",
      "group": "up-next",
      "record": null,
      "sequence": "none",
      "disclosure": "open",
      "children": [
        "next-card"
      ]
    },
    {
      "id": "next-card",
      "kind": "issue-card",
      "record": "jimmie-potts/agent-device-hub#900101",
      "presentation": "card",
      "primary": false,
      "reasons": [
        {
          "code": "question-match",
          "evidence": [
            {
              "field": "title"
            },
            {
              "field": "story.outcome.text"
            }
          ]
        },
        {
          "code": "epic-member",
          "evidence": [
            {
              "epic": "jimmie-potts/agent-device-hub#900100"
            }
          ]
        },
        {
          "code": "ready-candidate",
          "evidence": []
        }
      ]
    },
    {
      "id": "wall-card",
      "kind": "issue-card",
      "record": "jimmie-potts/codex-nanoleaf#900102",
      "presentation": "card",
      "primary": false,
      "reasons": [
        {
          "code": "question-match",
          "evidence": [
            {
              "field": "title"
            }
          ]
        },
        {
          "code": "epic-member",
          "evidence": [
            {
              "epic": "jimmie-potts/agent-device-hub#900100"
            }
          ]
        }
      ]
    },
    {
      "id": "graph",
      "kind": "section",
      "group": "relationships",
      "record": null,
      "sequence": "none",
      "disclosure": "collapsed",
      "children": [
        "next-prerequisites"
      ]
    },
    {
      "id": "next-prerequisites",
      "kind": "dependency-list",
      "record": "jimmie-potts/agent-device-hub#900101",
      "direction": "prerequisites",
      "scope": "direct"
    }
  ]
}
