{
  "schemaVersion": "guide-views/1.0",
  "recordsVersion": "guide-records/2.0",
  "datasetId": "sha256:13754f97c33a4b87dcb5ab29f7bf9e2b741916732290c6d7c574679a66a80a61",
  "catalogId": "sha256:b594947c7e91af036a7011b0238ccc670ea4796bcea81cd22ad672065a75cbe3",
  "origin": "ordinary",
  "page": {
    "kind": "epic",
    "record": "jimmie-potts/agent-device-hub#900100"
  },
  "layout": "stack",
  "root": [
    "browser"
  ],
  "components": [
    {
      "id": "browser",
      "kind": "epic",
      "record": "jimmie-potts/agent-device-hub#900100",
      "presentation": "full",
      "children": [
        "in-progress",
        "up-next",
        "other-work",
        "device-group",
        "done",
        "graph"
      ]
    },
    {
      "id": "in-progress",
      "kind": "section",
      "group": "in-progress",
      "record": null,
      "sequence": "none",
      "disclosure": "open",
      "children": [
        "wall-titles",
        "legacy-story"
      ]
    },
    {
      "id": "wall-titles",
      "kind": "issue-card",
      "record": "jimmie-potts/codex-nanoleaf#900102",
      "presentation": "card",
      "primary": true
    },
    {
      "id": "legacy-story",
      "kind": "issue-card",
      "record": "jimmie-potts/agent-device-hub#900109",
      "presentation": "card",
      "primary": true
    },
    {
      "id": "up-next",
      "kind": "section",
      "group": "up-next",
      "record": null,
      "sequence": "none",
      "disclosure": "open",
      "children": [
        "epic-pages"
      ]
    },
    {
      "id": "epic-pages",
      "kind": "issue-card",
      "record": "jimmie-potts/agent-device-hub#900101",
      "presentation": "card",
      "primary": true,
      "reasons": [
        {
          "code": "ready-candidate",
          "evidence": []
        }
      ]
    },
    {
      "id": "other-work",
      "kind": "section",
      "group": "backlog",
      "record": null,
      "sequence": "none",
      "disclosure": "open",
      "children": [
        "device-follow-ups"
      ]
    },
    {
      "id": "device-follow-ups",
      "kind": "issue-card",
      "record": "jimmie-potts/agent-device-hub#900103",
      "presentation": "card",
      "primary": true
    },
    {
      "id": "device-group",
      "kind": "section",
      "group": "parent-group",
      "record": "jimmie-potts/agent-device-hub#900103",
      "sequence": "none",
      "disclosure": "collapsed",
      "children": [
        "pixoo-previews"
      ]
    },
    {
      "id": "pixoo-previews",
      "kind": "issue-card",
      "record": "jimmie-potts/divoom-app-upgrade#900104",
      "presentation": "row",
      "primary": true
    },
    {
      "id": "done",
      "kind": "section",
      "group": "recently-done",
      "record": null,
      "sequence": "none",
      "disclosure": "collapsed",
      "children": [
        "layout-draft"
      ]
    },
    {
      "id": "layout-draft",
      "kind": "issue-card",
      "record": "jimmie-potts/agent-device-hub#900111",
      "presentation": "row",
      "primary": false
    },
    {
      "id": "graph",
      "kind": "section",
      "group": "relationships",
      "record": null,
      "sequence": "none",
      "disclosure": "collapsed",
      "children": [
        "epic-pages-prerequisites"
      ]
    },
    {
      "id": "epic-pages-prerequisites",
      "kind": "dependency-list",
      "record": "jimmie-potts/agent-device-hub#900101",
      "direction": "prerequisites",
      "scope": "direct"
    }
  ]
}
